{"build":{"artifact_locator":"file:performance/fixtures/result-v1.valid.json","source_provenance":"git:https://github.com/pablof7z/nampplets","source_revision":"2222222222222222222222222222222222222222"},"checksum_sha256":"0442f43b307030886214e5b57e7c25215d4333c7d12a78e550a4e57aef881d63","comparison_key":"feec2dfa68ad54fdbb25abbccd80c015d620b016760cf684c275761621a3db2d","identity":{"benchmark_id":"runtime.session.launch","build_mode":"release","environment_class":"macos-arm64-m4","fixture":{"cardinality":4,"id":"launch-v1","sha256":"1111111111111111111111111111111111111111111111111111111111111111"},"hardware":"MacBookPro M4 16GB","measurement_availability":{"cpu_time_ns":"available","peak_rss_bytes":"available"},"os":"macOS 26.0","power_state":"ac","protocol":{"outlier_policy":"tukey_upper_3_iqr_v1","per_sample_deadline_ns":5000000000,"run_deadline_ns":60000000000,"sample_count":4,"warmup_count":1},"reset_scopes":["runtime_store","artifact_cache"],"state":"warm","thermal_state":"nominal","toolchain":"rustc 1.88.0"},"producer_summary":{"diagnostic_outlier_sequences":[],"disposition":"diagnostic","distributions":[{"count":2,"max_ns":1200000,"outcome":"success","p50_ns":1000000,"p95_ns":1200000,"p99_ns":1200000,"population_variance_ns2":{"denominator":"4","numerator":"40000000000"}},{"count":1,"max_ns":150000,"outcome":"refused","p50_ns":150000,"p95_ns":150000,"p99_ns":150000,"population_variance_ns2":{"denominator":"1","numerator":"0"}},{"count":1,"max_ns":5000000000,"outcome":"deadline_exceeded","p50_ns":5000000000,"p95_ns":5000000000,"p99_ns":5000000000,"population_variance_ns2":{"denominator":"1","numerator":"0"}}],"outcome_counts":{"deadline_exceeded":1,"failed":0,"refused":1,"success":2},"refusal_groups":[{"code":"capacity","count":1,"domain":"runtime.queue"}],"sample_count":4},"run_id":"fixture-result-v1","samples":[{"cpu_time_ns":500000,"duration_ns":1000000,"outcome":"success","peak_rss_bytes":8388608,"sequence":0},{"cpu_time_ns":600000,"duration_ns":1200000,"outcome":"success","peak_rss_bytes":8392704,"sequence":1},{"cpu_time_ns":75000,"duration_ns":150000,"outcome":"refused","peak_rss_bytes":8396800,"refusal":{"code":"capacity","domain":"runtime.queue"},"sequence":2},{"cpu_time_ns":2500000000,"duration_ns":5000000000,"outcome":"deadline_exceeded","peak_rss_bytes":8400896,"sequence":3}],"schema_id":"urn:nampplets:performance:result:v1"}